{
  "schema_version": "memory-stability-correction-event/v1",
  "event_type": "correction_action_executed",
  "event_id": "correction-event-da8450b86afc94ed",
  "created_at": "2026-04-21T04:45:00.000Z",
  "session_id": "snapshot-strong-risk",
  "provider": "ollama:gemma4:e4b",
  "model_name": "gemma4:e4b",
  "source_snapshot": {
    "path": "tests/fixtures/memory-stability/redacted/strong-risk-runtime-snapshot.redacted.json",
    "snapshot_id": "strong-risk-runtime-snapshot",
    "source_snapshot_sha256": "a8f1fba92401a5d58023cc8b5f706fc952a21cabe3b2e7fa684ccb3b3163291a",
    "schema_version": "memory-stability-runtime-snapshot/v1",
    "correction_level": "strong",
    "c_t": 0.6736,
    "s_t": 0.3264
  },
  "execution": {
    "adapter": "agent-passport-memory-stability-adapter-contract",
    "adapter_invocation_id": "agent-passport-adapter-contract-strong-001",
    "actor_type": "test_fixture",
    "actor_id": "agent-passport-memory-stability-contract",
    "explicit_execution": true,
    "automatic_by_loader": false,
    "loader_auto_executed": false,
    "model_called": false,
    "authoritative_store_mutated": true,
    "status": "completed",
    "started_at": "2026-04-21T04:45:01.000Z",
    "completed_at": "2026-04-21T04:45:02.000Z",
    "actions": [
      {
        "action": "reanchor_key_memories_near_prompt_end",
        "requested_by_plan": true,
        "status": "completed",
        "target_memory_refs": [
          {
            "memory_id": "project-boundary",
            "content_sha256": "69780590887f153f18e37096246151de33ef3af2ff015b058b3382e97490fdd5"
          },
          {
            "memory_id": "handoff-next",
            "content_sha256": "fa0bb1f04a65e8b39915adda0f516cc3e3396d7473296611bf4171420461d315"
          },
          {
            "memory_id": "no-fake-data",
            "content_sha256": "304315499772315aa1eca4aefbd4059044a28df20a75ce127582ccb9597a8851"
          },
          {
            "memory_id": "provider-route",
            "content_sha256": "405633be5ea0187d0118e099876c656ca48e384aef83aee12d14ab6f11f35243"
          }
        ],
        "input_content_policy": "hash_only",
        "raw_content_persisted": false,
        "result": {
          "before_c_t": 0.6736,
          "after_c_t": 0.58,
          "summary": "Adapter reanchored key memory refs near prompt end using hash-only references."
        }
      },
      {
        "action": "raise_memory_injection_priority",
        "requested_by_plan": true,
        "status": "completed",
        "target_memory_refs": [
          {
            "memory_id": "project-boundary",
            "content_sha256": "69780590887f153f18e37096246151de33ef3af2ff015b058b3382e97490fdd5"
          },
          {
            "memory_id": "handoff-next",
            "content_sha256": "fa0bb1f04a65e8b39915adda0f516cc3e3396d7473296611bf4171420461d315"
          },
          {
            "memory_id": "no-fake-data",
            "content_sha256": "304315499772315aa1eca4aefbd4059044a28df20a75ce127582ccb9597a8851"
          },
          {
            "memory_id": "provider-route",
            "content_sha256": "405633be5ea0187d0118e099876c656ca48e384aef83aee12d14ab6f11f35243"
          }
        ],
        "input_content_policy": "hash_only",
        "raw_content_persisted": false,
        "result": {
          "before_c_t": 0.58,
          "after_c_t": 0.52,
          "summary": "Adapter raised injection priority for selected key memory refs."
        }
      },
      {
        "action": "rewrite_working_memory_summary",
        "requested_by_plan": true,
        "status": "completed",
        "target_memory_refs": [],
        "input_content_policy": "sanitized_summary_only",
        "raw_content_persisted": false,
        "result": {
          "before_c_t": 0.52,
          "after_c_t": 0.45,
          "summary": "Adapter rewrote working memory summary from sanitized runtime state."
        }
      },
      {
        "action": "compress_low_value_history",
        "requested_by_plan": true,
        "status": "completed",
        "target_memory_refs": [],
        "input_content_policy": "sanitized_summary_only",
        "raw_content_persisted": false,
        "result": {
          "before_c_t": 0.45,
          "after_c_t": 0.39,
          "summary": "Adapter compressed low-value history and kept audited summary metadata."
        }
      },
      {
        "action": "reload_authoritative_memory_store",
        "requested_by_plan": true,
        "status": "completed",
        "target_memory_refs": [
          {
            "memory_id": "project-boundary",
            "content_sha256": "69780590887f153f18e37096246151de33ef3af2ff015b058b3382e97490fdd5"
          },
          {
            "memory_id": "handoff-next",
            "content_sha256": "fa0bb1f04a65e8b39915adda0f516cc3e3396d7473296611bf4171420461d315"
          },
          {
            "memory_id": "no-fake-data",
            "content_sha256": "304315499772315aa1eca4aefbd4059044a28df20a75ce127582ccb9597a8851"
          },
          {
            "memory_id": "provider-route",
            "content_sha256": "405633be5ea0187d0118e099876c656ca48e384aef83aee12d14ab6f11f35243"
          }
        ],
        "input_content_policy": "hash_only",
        "raw_content_persisted": false,
        "result": {
          "before_c_t": 0.39,
          "after_c_t": 0.28,
          "summary": "Adapter refreshed authoritative memory state by memory refs."
        }
      },
      {
        "action": "resolve_conflicts_and_refresh_runtime_state",
        "requested_by_plan": true,
        "status": "completed",
        "target_memory_refs": [
          {
            "memory_id": "project-boundary",
            "content_sha256": "69780590887f153f18e37096246151de33ef3af2ff015b058b3382e97490fdd5"
          },
          {
            "memory_id": "handoff-next",
            "content_sha256": "fa0bb1f04a65e8b39915adda0f516cc3e3396d7473296611bf4171420461d315"
          },
          {
            "memory_id": "no-fake-data",
            "content_sha256": "304315499772315aa1eca4aefbd4059044a28df20a75ce127582ccb9597a8851"
          },
          {
            "memory_id": "provider-route",
            "content_sha256": "405633be5ea0187d0118e099876c656ca48e384aef83aee12d14ab6f11f35243"
          }
        ],
        "input_content_policy": "hash_only",
        "raw_content_persisted": false,
        "result": {
          "before_c_t": 0.28,
          "after_c_t": 0.16,
          "summary": "Adapter resolved conflicting memory refs and refreshed runtime state."
        }
      }
    ]
  },
  "audit": {
    "event_type": "correction_execution",
    "raw_content_persisted": false,
    "content_policy": "hash_only",
    "idempotency_key": "strong-risk-runtime-snapshot:agent-passport-adapter-contract-strong-001",
    "notes": "Test fixture generated a correction execution event from explicit fixture receipts."
  }
}
